[
  {
    "name": "A Few Good Men",
    "title": "A Few Good Men",
    "year": 1992,
    "actors": [
      "Tom Cruise",
      "Jack Nicholson",
      "Demi Moore"
    ],
    "genre": [
      "Drama",
      "Thriller"
    ],
    "poster_link": "https://m.media-amazon.com/images/M/MV5BOGVhMTUwYzEtZGQ1ZC00Nzg1LTk0OGUtMDk0NDM0ZmZlN2E0XkEyXkFqcGc@._V1_SX300.jpg"
  },
  {
    "name": "Heat",
    "title": "Heat",
    "year": 1995,
    "actors": [
      "Al Pacino",
      "Robert De Niro",
      "Val Kilmer"
    ],
    "genre": [
      "Action",
      "Crime",
      "Drama"
    ],
    "poster_link": "https://m.media-amazon.com/images/M/MV5BMTkxYjU1OTMtYWViZC00ZjAzLWI3MDktZGQ2N2VmMjVjNDRlXkEyXkFqcGc@._V1_SX300.jpg"
  },
  {
    "name": "Gladiator",
    "title": "Gladiator",
    "year": 2000,
    "actors": [
      "Russell Crowe",
      "Joaquin Phoenix",
      "Connie Nielsen"
    ],
    "genre": [
      "Action",
      "Adventure",
      "Drama"
    ],
    "poster_link": "https://m.media-amazon.com/images/M/MV5BYWQ4YmNjYjEtOWE1Zi00Y2U4LWI4NTAtMTU0MjkxNWQ1ZmJiXkEyXkFqcGc@._V1_SX300.jpg"
  },
  {
    "name": "K-PAX",
    "title": "K-PAX",
    "year": 2001,
    "actors": [
      "Kevin Spacey",
      "Jeff Bridges",
      "Mary McCormack"
    ],
    "genre": [
      "Drama",
      "Mystery",
      "Sci-Fi"
    ],
    "poster_link": "https://m.media-amazon.com/images/M/MV5BZWU5MTJiNDMtMmI0Yy00MWRjLTgwZjktODEyY2NmZThhM2EwXkEyXkFqcGc@._V1_SX300.jpg"
  },
  {
    "name": "The Accountant",
    "title": "The Accountant",
    "year": 2016,
    "actors": [
      "Ben Affleck",
      "Anna Kendrick",
      "J.K. Simmons"
    ],
    "genre": [
      "Action",
      "Crime",
      "Drama"
    ],
    "poster_link": "https://m.media-amazon.com/images/M/MV5BNDc5Mzg2NTYxNV5BMl5BanBnXkFtZTgwMjQ2ODAwOTE@._V1_SX300.jpg"
  },
  {
    "name": "The Bone Collector",
    "title": "The Bone Collector",
    "year": 1999,
    "actors": [
      "Denzel Washington",
      "Angelina Jolie",
      "Queen Latifah"
    ],
    "genre": [
      "Crime",
      "Drama",
      "Mystery"
    ],
    "poster_link": "https://m.media-amazon.com/images/M/MV5BOWY0NjY0M2ItYmNjYy00YWZiLWE3ZjktM2Q3YmU2NWY0YmVmXkEyXkFqcGc@._V1_SX300.jpg"
  },
  {
    "name": "No Country for Old Men",
    "title": "No Country for Old Men",
    "year": 2007,
    "actors": [
      "Tommy Lee Jones",
      "Javier Bardem",
      "Josh Brolin"
    ],
    "genre": [
      "Crime",
      "Drama",
      "Thriller"
    ],
    "poster_link": "https://m.media-amazon.com/images/M/MV5BMjA5Njk3MjM4OV5BMl5BanBnXkFtZTcwMTc5MTE1MQ@@._V1_SX300.jpg"
  },
  {
    "name": "Limitless",
    "title": "Limitless",
    "year": 2011,
    "actors": [
      "Bradley Cooper",
      "Anna Friel",
      "Abbie Cornish"
    ],
    "genre": [
      "Sci-Fi",
      "Thriller"
    ],
    "poster_link": "https://m.media-amazon.com/images/M/MV5BMWQ4OTQ4YzYtODlmMi00ZjA0LTg5M2QtZWUzNjA5N2NmODE5XkEyXkFqcGc@._V1_SX300.jpg"
  },
  {
    "name": "The Devil's Advocate",
    "title": "The Devil's Advocate",
    "year": 1997,
    "actors": [
      "Keanu Reeves",
      "Al Pacino",
      "Charlize Theron"
    ],
    "genre": [
      "Drama",
      "Fantasy",
      "Mystery"
    ],
    "poster_link": "https://m.media-amazon.com/images/M/MV5BNGIxZmU2ZjEtYjc3OC00Y2FiLWE2ZTQtZGI3NzE0YmRhOTMxXkEyXkFqcGc@._V1_SX300.jpg"
  },
  {
    "name": "City of Angels",
    "title": "City of Angels",
    "year": 1998,
    "actors": [
      "Nicolas Cage",
      "Meg Ryan",
      "Andre Braugher"
    ],
    "genre": [
      "Drama",
      "Fantasy",
      "Romance"
    ],
    "poster_link": "https://m.media-amazon.com/images/M/MV5BODYwMzM3ODEtZWZjOS00NWZhLWE2MWUtMDFlMWNiNGEwOWNlXkEyXkFqcGc@._V1_SX300.jpg"
  },
  {
    "name": "Meet Joe Black",
    "title": "Meet Joe Black",
    "year": 1998,
    "actors": [
      "Brad Pitt",
      "Anthony Hopkins",
      "Claire Forlani"
    ],
    "genre": [
      "Drama",
      "Fantasy",
      "Romance"
    ],
    "poster_link": "https://m.media-amazon.com/images/M/MV5BMjVjNjAwYWItMDc0ZC00MTEwLWJiN2MtM2U4YThjNWE5YTZmXkEyXkFqcGc@._V1_SX300.jpg"
  },
  {
    "name": "Seven",
    "title": "Seven",
    "year": 1995,
    "actors": [
      "Brad Pitt" , "Morgan Freeman" , "Gwyneth Paltrow", "R. Lee Ermey"
    ],
    "genre": [
      "Suspense",
      "Dark",
      "Psychological"
    ],
    "poster_link": "https://m.media-amazon.com/images/I/71VT4EwvAAL._AC_UY327_FMwebp_QL65_.jpg"
  },
  {
    "name": "The Client",
    "title": "The Client",
    "year": 1994,
    "actors": [
      "Susan Sarandon",
      "Tommy Lee Jones",
      "Brad Renfro"
    ],
    "genre": [
      "Crime",
      "Drama",
      "Mystery"
    ],
    "poster_link": "https://m.media-amazon.com/images/M/MV5BNWQzNGEyODctZGY4My00ZjA3LWI0OWUtMWQ3NzVkMzQyN2ZjXkEyXkFqcGc@._V1_SX300.jpg"
  },
  {
    "name": "Constantine",
    "title": "Constantine",
    "year": 2005,
    "actors": [
      "Keanu Reeves",
      "Rachel Weisz",
      "Djimon Hounsou"
    ],
    "genre": [
      "Action",
      "Fantasy",
      "Horror"
    ],
    "poster_link": "https://m.media-amazon.com/images/M/MV5BMjNhNTlmYmYtYjcxZi00ZDU1LTkxMWYtYzFlMWMzY2RiODM1XkEyXkFqcGc@._V1_SX300.jpg"
  },
  {
    "name": "The Matrix",
    "title": "The Matrix",
    "year": 1999,
    "actors": [
      "Keanu Reeves",
      "Laurence Fishburne",
      "Carrie-Anne Moss"
    ],
    "genre": [
      "Action",
      "Sci-Fi"
    ],
    "poster_link": "https://m.media-amazon.com/images/M/MV5BN2NmN2VhMTQtMDNiOS00NDlhLTliMjgtODE2ZTY0ODQyNDRhXkEyXkFqcGc@._V1_SX300.jpg"
  },
  {
    "name": "The Matrix Reloaded",
    "title": "The Matrix Reloaded",
    "year": 2003,
    "actors": [
      "Keanu Reeves",
      "Laurence Fishburne",
      "Carrie-Anne Moss"
    ],
    "genre": [
      "Action",
      "Sci-Fi"
    ],
    "poster_link": "https://m.media-amazon.com/images/M/MV5BNjAxYjkxNjktYTU0YS00NjFhLWIyMDEtMzEzMTJjMzRkMzQ1XkEyXkFqcGc@._V1_SX300.jpg"
  },
  {
    "name": "The Matrix Revolutions",
    "title": "The Matrix Revolutions",
    "year": 2003,
    "actors": [
      "Keanu Reeves",
      "Laurence Fishburne",
      "Carrie-Anne Moss"
    ],
    "genre": [
      "Action",
      "Sci-Fi"
    ],
    "poster_link": "https://m.media-amazon.com/images/M/MV5BMmNmMTEzODQtNmExMS00OGUxLWFkNTItMTM3NzBlNDk0YWU5XkEyXkFqcGc@._V1_SX300.jpg"
  },
  {
    "name": "The Green Mile",
    "title": "The Green Mile",
    "year": 1999,
    "actors": [
      "Tom Hanks",
      "Michael Clarke Duncan",
      "David Morse"
    ],
    "genre": [
      "Crime",
      "Drama",
      "Fantasy"
    ],
    "poster_link": "https://m.media-amazon.com/images/M/MV5BMTUxMzQyNjA5MF5BMl5BanBnXkFtZTYwOTU2NTY3._V1_SX300.jpg"
  },
  {
    "name": "The Family Man",
    "title": "The Family Man",
    "year": 2000,
    "actors": [
      "Nicolas Cage",
      "TÃ©a Leoni",
      "Don Cheadle"
    ],
    "genre": [
      "Comedy",
      "Drama",
      "Fantasy"
    ],
    "poster_link": "https://m.media-amazon.com/images/M/MV5BN2I4ODE3YzQtMzZhMy00YjhlLWE1MmMtYTA0MjkxNTJmMTZlXkEyXkFqcGc@._V1_SX300.jpg"
  },
  {
    "name": "The Silence of the Lambs",
    "title": "The Silence of the Lambs",
    "year": 1991,
    "actors": [
      "Jodie Foster",
      "Anthony Hopkins",
      "Scott Glenn"
    ],
    "genre": [
      "Crime",
      "Drama",
      "Horror"
    ],
    "poster_link": "https://m.media-amazon.com/images/M/MV5BNDdhOGJhYzctYzYwZC00YmI2LWI0MjctYjg4ODdlMDExYjBlXkEyXkFqcGc@._V1_SX300.jpg"
  },
  {
    "name": "Uncharted",
    "title": "Uncharted",
    "year": 2022,
    "actors": [
      "Tom Holland",
      "Mark Wahlberg",
      "Antonio Banderas"
    ],
    "genre": [
      "Action",
      "Adventure"
    ],
    "poster_link": "https://m.media-amazon.com/images/M/MV5BYjQxYWNiNzgtOTc2Yi00OGEwLTk5MjAtODdiZTk0ZDJlZGY4XkEyXkFqcGc@._V1_SX300.jpg"
  },
  {
    "name": "Twister",
    "title": "Twister",
    "year": 1996,
    "actors": [
      "Helen Hunt",
      "Bill Paxton",
      "Jami Gertz"
    ],
    "genre": [
      "Action",
      "Adventure",
      "Thriller"
    ],
    "poster_link": "https://m.media-amazon.com/images/M/MV5BNGVhY2JjYzgtYjAyOC00ODg0LTliYWEtMzliZWYzMjA2NjYyXkEyXkFqcGc@._V1_SX300.jpg"
  },
  {
    "name": "Ford v Ferrari",
    "title": "Ford v Ferrari",
    "year": 2019,
    "actors": [
      "Matt Damon",
      "Christian Bale",
      "Jon Bernthal"
    ],
    "genre": [
      "Action",
      "Biography",
      "Drama"
    ],
    "poster_link": "https://m.media-amazon.com/images/M/MV5BOTBjNTEyNjYtYjdkNi00YzE5LTljYzUtZjVlYmYwZmJmZWYxXkEyXkFqcGc@._V1_SX300.jpg"
  },
  {
    "name": "Stigmata",
    "title": "Stigmata",
    "year": 1999,
    "actors": [
      "Patricia Arquette",
      "Gabriel Byrne",
      "Jonathan Pryce"
    ],
    "genre": [
      "Horror",
      "Mystery"
    ],
    "poster_link": "https://m.media-amazon.com/images/M/MV5BMTQwMDA1NzI4OV5BMl5BanBnXkFtZTcwNzM4MjM3NA@@._V1_SX300.jpg"
  },
  {
    "name": "The Devil's Own",
    "title": "The Devil's Own",
    "year": 1997,
    "actors": [
      "Harrison Ford",
      "Brad Pitt",
      "Margaret Colin"
    ],
    "genre": [
      "Action",
      "Crime",
      "Drama"
    ],
    "poster_link": "https://m.media-amazon.com/images/M/MV5BNDU1ODI0ZGUtZDA3My00NGViLWFhM2QtNmI1NzU0ZTA1ODc5XkEyXkFqcGc@._V1_SX300.jpg"
  },
  {
    "name": "Top Gun",
    "title": "Top Gun",
    "year": 1986,
    "actors": [
      "Tom Cruise",
      "Tim Robbins",
      "Kelly McGillis"
    ],
    "genre": [
      "Action",
      "Drama"
    ],
    "poster_link": "https://m.media-amazon.com/images/M/MV5BZmVjNzQ3MjYtYTZiNC00Y2YzLWExZTEtMTM2ZDllNDI0MzgyXkEyXkFqcGc@._V1_SX300.jpg"
  },
  {
    "name": "Top Gun: Maverick",
    "title": "Top Gun: Maverick",
    "year": 2022,
    "actors": [
      "Tom Cruise",
      "Jennifer Connelly",
      "Miles Teller"
    ],
    "genre": [
      "Action",
      "Drama"
    ],